{
  "command_id": "cmd_01HABCDEF123456789",
  "trace_id": "trc_01HABCDEF123456789",
  "idempotency_key": "upload_01HABCDEF123456789",
  "actor": "user-001",
  "tenant_id": "tenant_acme",
  "collection_id": "col_default",
  "filename": "annual_report_2025.pdf",
  "mime_type": "application/pdf",
  "size_bytes": 2457600,
  "selected_parser_profile_id": "parser_naive_v1",
  "parser_override_json": {}
}
